{
  "schema_version": "0.1",
  "household": {
    "id": "01MERFXMM00000000000000009",
    "base_currency": "GBP",
    "secondary_currency": "USD",
    "persons": [
      {
        "id": "01MERFXMM00000000000000001",
        "display_token": "P1",
        "tax_profile": {
          "uk_resident": true,
          "us_person": false
        }
      }
    ]
  },
  "accounts": [
    {
      "id": "01MERFXMM00000000000000003",
      "person_ids": [
        "01MERFXMM00000000000000001"
      ],
      "institution": "Alderbrook Platform",
      "account_token": "A1",
      "wrapper": "gia",
      "wrapper_jurisdiction": "UK",
      "custody_currency": "GBP",
      "opened": null,
      "data_asof": "2026-06-30"
    },
    {
      "id": "01MERFXMM00000000000000004",
      "person_ids": [
        "01MERFXMM00000000000000001"
      ],
      "institution": "Liberty Street Securities",
      "account_token": "A2",
      "wrapper": "us_brokerage",
      "wrapper_jurisdiction": "US",
      "custody_currency": "USD",
      "opened": null,
      "data_asof": "2026-02-15"
    }
  ],
  "instruments": [
    {
      "id": "01MERFXMM00000000000000005",
      "identifiers": {},
      "name": "Northgate UK Smaller Companies OEIC",
      "type": "oeic",
      "domicile": "GB",
      "pfic_status": "not_assessed",
      "metadata_confirmed": true,
      "prices": [
        {
          "date": "2026-06-30",
          "price": {
            "amount": 1,
            "currency": "GBP"
          },
          "source": "statement"
        }
      ]
    },
    {
      "id": "01MERFXMM00000000000000006",
      "identifiers": {},
      "name": "Pioneer S&P Index Fund",
      "type": "mutual_fund_us",
      "domicile": "US",
      "pfic_status": "not_assessed",
      "metadata_confirmed": true,
      "prices": [
        {
          "date": "2026-06-30",
          "price": {
            "amount": 1,
            "currency": "USD"
          },
          "source": "statement"
        }
      ]
    },
    {
      "id": "01MERFXMM00000000000000007",
      "identifiers": {},
      "name": "Continental Europe Equity SICAV",
      "type": "other_pooled",
      "domicile": "LU",
      "pfic_status": "not_assessed",
      "metadata_confirmed": true,
      "prices": [
        {
          "date": "2026-06-30",
          "price": {
            "amount": 1,
            "currency": "EUR"
          },
          "source": "statement"
        }
      ]
    },
    {
      "id": "01MERFXMM00000000000000008",
      "identifiers": {},
      "name": "Keystone Treasury Money Market Fund",
      "type": "mmf",
      "domicile": "US",
      "pfic_status": "not_assessed",
      "metadata_confirmed": true,
      "prices": [
        {
          "date": "2026-02-15",
          "price": {
            "amount": 1,
            "currency": "USD"
          },
          "source": "statement"
        }
      ]
    }
  ],
  "holdings": [
    {
      "account_id": "01MERFXMM00000000000000003",
      "instrument_id": "01MERFXMM00000000000000005",
      "asof": "2026-06-30",
      "units": 10000,
      "value": {
        "amount": 10000,
        "currency": "GBP"
      },
      "source_document_id": "01MERFXMM00000000000000002"
    },
    {
      "account_id": "01MERFXMM00000000000000003",
      "instrument_id": "01MERFXMM00000000000000006",
      "asof": "2026-06-30",
      "units": 12800,
      "value": {
        "amount": 12800,
        "currency": "USD"
      },
      "source_document_id": "01MERFXMM00000000000000002"
    },
    {
      "account_id": "01MERFXMM00000000000000003",
      "instrument_id": "01MERFXMM00000000000000007",
      "asof": "2026-06-30",
      "units": 5400,
      "value": {
        "amount": 5400,
        "currency": "EUR"
      },
      "source_document_id": "01MERFXMM00000000000000002"
    },
    {
      "account_id": "01MERFXMM00000000000000004",
      "instrument_id": "01MERFXMM00000000000000008",
      "asof": "2026-02-15",
      "units": 2500,
      "value": {
        "amount": 2500,
        "currency": "USD"
      },
      "source_document_id": "01MERFXMM00000000000000002"
    }
  ],
  "transactions": [],
  "documents": [
    {
      "id": "01MERFXMM00000000000000002",
      "filename": "synthetic/fx-mismatch.txt",
      "sha256": "1111111111111111111111111111111111111111111111111111111111111111",
      "institution": "Synthetic Fixture",
      "doc_type": "valuation",
      "period": {
        "from": "2026-01-01",
        "to": "2026-06-30"
      },
      "parsed_at": "2026-07-30T11:00:00Z",
      "accepted_at": "2026-07-30T12:00:00Z",
      "parse_run_ids": [
        "RUN-FX-01"
      ]
    }
  ],
  "acceptances": [
    {
      "id": "01MERFXMM00000000000000010",
      "document_id": "01MERFXMM00000000000000002",
      "parse_run_id": "RUN-FX-01",
      "accepted_at": "2026-07-30T12:00:00Z",
      "operator_initials": "JC",
      "lines": [
        {
          "kind": "holding",
          "account_token": "A1",
          "ref": "Northgate UK Smaller Companies OEIC",
          "action": "accepted",
          "instrument_id": "01MERFXMM00000000000000005"
        },
        {
          "kind": "holding",
          "account_token": "A1",
          "ref": "Pioneer S&P Index Fund",
          "action": "accepted",
          "instrument_id": "01MERFXMM00000000000000006"
        },
        {
          "kind": "holding",
          "account_token": "A1",
          "ref": "Continental Europe Equity SICAV",
          "action": "accepted",
          "instrument_id": "01MERFXMM00000000000000007"
        },
        {
          "kind": "holding",
          "account_token": "A2",
          "ref": "Keystone Treasury Money Market Fund",
          "action": "accepted",
          "instrument_id": "01MERFXMM00000000000000008"
        }
      ]
    }
  ],
  "fx_rates": [
    {
      "date": "2026-01-31",
      "pair": "GBPUSD",
      "rate": 1.25,
      "source": "statement:synthetic/fx-mismatch"
    },
    {
      "date": "2026-06-10",
      "pair": "GBPUSD",
      "rate": 1.28,
      "source": "statement:synthetic/fx-mismatch"
    },
    {
      "date": "2026-06-10",
      "pair": "EURUSD",
      "rate": 1.08,
      "source": "statement:synthetic/fx-mismatch"
    }
  ]
}
